{
  "schemaVersion": "2.0",
  "featurePath": "specs/005-sandbox-secure-development",
  "declaredAt": "2026-08-30T15:18:00Z",
  "gates": [
    {
      "gateId": "SBX-IDENTITY-GATE-001",
      "applicability": "Applicable",
      "requiredScope": "Validate run identity and all four accepted input byte hashes before every mutable phase and after interruption.",
      "exactCommands": [
        "pwsh -NoLogo -NoProfile -File .specify/presets/autonomous-run-governance/scripts/validate-autonomous-run-state.ps1 -State specs/005-sandbox-secure-development/autonomous-run-state.json",
        "pwsh -NoLogo -NoProfile -Command '$state = Get-Content -LiteralPath \"specs/005-sandbox-secure-development/autonomous-run-state.json\" -Raw -Encoding UTF8 | ConvertFrom-Json; foreach ($item in $state.acceptedArtifacts) { $actual = (Get-FileHash -LiteralPath $item.path -Algorithm SHA256).Hash.ToLowerInvariant(); if ($actual -ne $item.sha256) { throw \"Accepted input drift: $($item.path)\" } }; \"PASS: accepted inputs\"'"
      ],
      "requiredCommandTokens": ["validate-autonomous-run-state.ps1", "Get-FileHash", "Accepted input drift"],
      "requiredRunnerOrPlatformTokens": ["macOS", "PowerShell 7", "Git"],
      "evidencePath": "specs/005-sandbox-secure-development/autonomous-run-evidence.md",
      "rationale": "Input drift invalidates every downstream assessment and delivery claim.",
      "reevaluationTrigger": "Every phase boundary, resume, commit, push, and remote delivery step."
    },
    {
      "gateId": "SBX-REFERENCE-GATE-002",
      "applicability": "Applicable",
      "requiredScope": "Confirm the separate Sandbox reference is read-only observed at the exact accepted commit without persisting its private host root.",
      "exactCommands": [
        "pwsh -NoLogo -NoProfile -Command 'if ([string]::IsNullOrWhiteSpace($env:SANDBOX_REFERENCE_ROOT)) { throw \"SANDBOX_REFERENCE_ROOT not set\" }; $head = git -C $env:SANDBOX_REFERENCE_ROOT rev-parse HEAD; if ($LASTEXITCODE -ne 0 -or $head -ne \"05d1202b3364cba3d0e48e6c32e10b34a62ba1f0\") { throw \"Sandbox reference drift\" }; \"PASS: immutable Sandbox reference\"'"
      ],
      "requiredCommandTokens": ["SANDBOX_REFERENCE_ROOT", "05d1202b3364cba3d0e48e6c32e10b34a62ba1f0", "Sandbox reference drift"],
      "requiredRunnerOrPlatformTokens": ["macOS", "PowerShell 7", "Git", "read-only"],
      "evidencePath": "specs/005-sandbox-secure-development/research.md",
      "rationale": "Only committed Sandbox facts are reproducible and public-ready evidence.",
      "reevaluationTrigger": "Sandbox commit, image identity, or reference-document change."
    },
    {
      "gateId": "SBX-DOCUMENT-REDGREEN-GATE-003",
      "applicability": "Applicable",
      "requiredScope": "Record the result files missing before implementation and the unchanged contract passing after the smallest documentation slice.",
      "exactCommands": [
        "pwsh -NoLogo -NoProfile -Command '$required = @(\"specs/005-sandbox-secure-development/sandbox-assessment.md\", \"specs/005-sandbox-secure-development/evidence-matrix.md\"); $missing = @($required | Where-Object { -not (Test-Path -LiteralPath $_ -PathType Leaf) }); if ($missing.Count) { throw \"Missing assessment outputs: $($missing -join ', ')\" }; \"PASS: assessment output files\"'"
      ],
      "requiredCommandTokens": ["sandbox-assessment.md", "evidence-matrix.md", "Missing assessment outputs"],
      "requiredRunnerOrPlatformTokens": ["macOS", "PowerShell 7", "documentation contract"],
      "evidencePath": "specs/005-sandbox-secure-development/autonomous-run-evidence.md",
      "rationale": "Pure governance work uses an observable document-contract red/green slice instead of product TDD.",
      "reevaluationTrigger": "Any required assessment output or contract change."
    },
    {
      "gateId": "SBX-CL12-GATE-004",
      "applicability": "Applicable",
      "requiredScope": "Require all twelve canonical CL-12 IDs once and all status, ownership, rationale, evidence, risk, trigger, and follow-up fields.",
      "exactCommands": [
        "pwsh -NoLogo -NoProfile -Command '$path = \"specs/005-sandbox-secure-development/sandbox-assessment.md\"; $text = Get-Content -LiteralPath $path -Raw -Encoding UTF8; $sections = @([regex]::Matches($text, \"(?ms)^### (CL-12-(?:0[1-9]|1[0-2])).*?(?=^### CL-12-|\\z)\")); $ids = @($sections | ForEach-Object { $_.Groups[1].Value }); if ($ids.Count -ne 12 -or @($ids | Sort-Object -Unique).Count -ne 12) { throw \"Expected 12 unique CL-12 sections\" }; foreach ($section in $sections) { foreach ($token in @(\"Applicability\", \"Implementation status\", \"Learning stage\", \"Responsible role\", \"Evidence\", \"Residual risk\", \"Re-evaluation trigger\", \"Next action\")) { if ($section.Value -notmatch [regex]::Escape($token)) { throw \"$($section.Groups[1].Value) lacks $token\" } } }; \"PASS: CL-12 completeness\"'"
      ],
      "requiredCommandTokens": ["### (CL-12-", "Expected 12 unique CL-12 sections", "CL-12 completeness"],
      "requiredRunnerOrPlatformTokens": ["macOS", "PowerShell 7", "CL-12 v2.2.0"],
      "evidencePath": "specs/005-sandbox-secure-development/sandbox-assessment.md",
      "rationale": "A complete assessment may retain Open findings but may not omit a checklist item or required field.",
      "reevaluationTrigger": "CL-12 version, assessment row, status, or evidence change."
    },
    {
      "gateId": "SBX-BOUNDARY-GATE-005",
      "applicability": "Applicable",
      "requiredScope": "Require symbolic mount and work-location matrices that deny unrelated host, profile, key, and project surfaces.",
      "exactCommands": [
        "pwsh -NoLogo -NoProfile -Command '$text = Get-Content -LiteralPath \"specs/005-sandbox-secure-development/sandbox-assessment.md\" -Raw -Encoding UTF8; foreach ($token in @(\"<TinyPl0-repository>\", \"ReadOnly\", \"ReadWrite\", \"NotMounted\", \"Build\", \"Test\", \"CI\", \"HumanOnly\")) { if ($text -notmatch [regex]::Escape($token)) { throw \"Boundary matrix lacks $token\" } }; \"PASS: mount and work-location boundaries\"'"
      ],
      "requiredCommandTokens": ["<TinyPl0-repository>", "NotMounted", "HumanOnly", "mount and work-location boundaries"],
      "requiredRunnerOrPlatformTokens": ["macOS", "PowerShell 7", "text-first evidence"],
      "evidencePath": "specs/005-sandbox-secure-development/sandbox-assessment.md",
      "rationale": "A broad host or adjacent-project mount defeats the TinyPl0-only agent boundary.",
      "reevaluationTrigger": "Mount, writable-root, agent-mode, work-location, or host-platform change."
    },
    {
      "gateId": "SBX-STANDARDS-GATE-006",
      "applicability": "Applicable",
      "requiredScope": "Map security, architecture, accessibility, supply-chain, regulatory, and all eight preset decisions with rationale and triggers.",
      "exactCommands": [
        "pwsh -NoLogo -NoProfile -Command '$text = Get-Content -LiteralPath \"specs/005-sandbox-secure-development/evidence-matrix.md\" -Raw -Encoding UTF8; foreach ($token in @(\"NIST SSDF\", \"CWE Top 25\", \"SBOM\", \"VEX\", \"AI-SBOM\", \"SLSA\", \"OpenSSF\", \"SAMM\", \"Zero Trust\", \"WCAG 2.2\", \"security-governance\", \"parallel-autonomous-run-governance\")) { if ($text -notmatch [regex]::Escape($token)) { throw \"Evidence matrix lacks $token\" } }; \"PASS: standards and presets\"'"
      ],
      "requiredCommandTokens": ["NIST SSDF", "CWE Top 25", "parallel-autonomous-run-governance", "standards and presets"],
      "requiredRunnerOrPlatformTokens": ["macOS", "PowerShell 7", "eight presets"],
      "evidencePath": "specs/005-sandbox-secure-development/evidence-matrix.md",
      "rationale": "Silent standards or preset omission would invalidate the Level-2 assessment.",
      "reevaluationTrigger": "Constitution, preset, standard, or applicability change."
    },
    {
      "gateId": "SBX-SCOPE-GATE-007",
      "applicability": "Applicable",
      "requiredScope": "Reject product, test, workflow, existing docs/security, and any Sandbox repository change from the TinyPl0 feature delivery set.",
      "exactCommands": [
        "pwsh -NoLogo -NoProfile -Command '$base = git merge-base main HEAD; $allowed = \"^(\\.specify/feature\\.json|specs/005-sandbox-secure-development/|docs/project-statistics\\.(md|config\\.json)$|src/Pl0\\.Ide/Pl0\\.Ide\\.csproj$)\"; $paths = @((git diff --name-only $base HEAD); (git diff --name-only); (git diff --cached --name-only); (git ls-files --others --exclude-standard)) | Where-Object { $_ } | Sort-Object -Unique; $bad = @($paths | Where-Object { $_ -notmatch $allowed }); if ($bad.Count) { throw \"Out-of-scope path: $($bad -join ', ')\" }; \"PASS: bounded delivery paths\"'"
      ],
      "requiredCommandTokens": ["git merge-base main HEAD", "git ls-files --others --exclude-standard", "Out-of-scope path", "bounded delivery paths"],
      "requiredRunnerOrPlatformTokens": ["macOS", "PowerShell 7", "Git"],
      "evidencePath": "specs/005-sandbox-secure-development/autonomous-run-evidence.md",
      "rationale": "The intake forbids technical hardening and automatic population of existing security evidence.",
      "reevaluationTrigger": "Every edit, commit, delivery-set freeze, and exact-head validation."
    },
    {
      "gateId": "SBX-SECRET-PATH-GATE-008",
      "applicability": "Applicable",
      "requiredScope": "Scan only intended public delivery files for secret patterns and concrete private host paths without reading forbidden local state.",
      "exactCommands": [
        "gitleaks git --redact --log-opts=main..HEAD",